{
  "artifact_type": "mcp_runtime_config",
  "artifact_version": "1.0",
  "server": {
    "name": "numtema-mcp",
    "version": "1.0.0",
    "protocol_version": "2025-11-25",
    "transport": {
      "type": "streamable_http",
      "host": "127.0.0.1",
      "port": 8787,
      "path": "/mcp",
      "allowed_origins": ["https://chatgpt.com"],
      "bearer_token_env": "MCP_SERVER_TOKEN",
      "require_mcp_headers": true
    }
  },
  "provider": { "base_url": "https://api.example.test", "timeout_ms": 30000 },
  "artifacts": {
    "contract_bundle": "./contract-bundle.json",
    "provider_adapter_bundle": "./provider-adapters.json",
    "provider_auth_binding_bundle": "./provider-auth-bindings.json",
    "credential_catalog": "./credential-catalog.json",
    "runtime_trust_store": "./runtime-trust-store.json",
    "ledger_directory": "./ledger"
  },
  "context": {
    "subject_ref": "user-001",
    "client_ref": "chatgpt-client",
    "workspace_ref": "workspace-001",
    "provider_ref": "provider-001"
  },
  "credentials": { "environment_by_handle": { "credential-handle-001": "PROVIDER_TOKEN" } },
  "signing": {
    "policy": { "key_id": "policy-key", "private_key_file": "./policy-private.pem" },
    "dispatch": { "key_id": "dispatch-key", "private_key_file": "./dispatch-private.pem" },
    "execution": { "key_id": "execution-key", "private_key_file": "./execution-private.pem" }
  }
}
